{
  "action_id": "run-rounds.v1",
  "action_version": "1.0.0",
  "architecture_guard_policy_version": 2,
  "authorization": {
    "approved_at": "YYYY-MM-DDTHH:MM:SSZ",
    "source": "control-room-button"
  },
  "checkpoint_required": true,
  "created_at": "YYYY-MM-DDTHH:MM:SSZ",
  "lab_id": "lab-id",
  "model": "gpt-5.6-sol",
  "protocol_version": 1,
  "reasoning_effort": "ultra",
  "request_id": "request-id",
  "round_id": "round-id",
  "schema_version": 1,
  "scope": "Exact user-approved research scope.",
  "scope_sha256": "0000000000000000000000000000000000000000000000000000000000000000"
}
